Title,Date Time,Body
What do you call a group of men waiting for a haircut?,1 day ago,"""And if I see you one more time dressing up in my clothes, you're "
"I saw a sign that said ""Watch for children""",21 hours ago,"And I thought, ""That sounds like a fair trade""."
Massive tip to avoid Coronavirus,18 hours ago,Avoid social interact-
My girlfriend is like a calendar,1 day ago,Oh wait... nvm
Quick tips to make running on a treadmill more bearable,8 hours ago,She has 12 months
Nobody came to my party.,8 hours ago,Step 1: Add a bear
"How many ""sup dude""s does it take to screw in a lightbulb?",19 hours ago,Cool guy. Tells an awesome story about Polyphemus!
Why did the Germans cry when they tried invading Russia (USSR)?,9 hours ago,"None, it's already lit fam."
Having sex is like going for a bad massage.,9 hours ago,Because they couldn't get past the Soviet Onion.
Stop with the Cripple Jokes!,1 day ago,I can’t stand them.
Winning the lottery is like an invisible ghost that masturbates in public,16 hours ago,You'll never see it coming.
Bad Genie says don’t make that wish,10 hours ago,A guy is having marital problems  and he goes for a walk. for whatever reason decides to kick a can. Turns out the can was actually a lamp with a genie inside. The Genie appears with a woosh.
I went whale watching last week,21 hours ago,“Aww man. Not again. Look man. I’m a bad genie. Whatever you wish for I’m gonna do it. But I’m gonna make sure it’s bad. You really don’t want to wish for anything man. “
Women always tell me they have something to get off their chest,16 hours ago,The guy says “oh no you don’t get it. I hope this is bad. The worst. My wife’s mother lives with us and all she does is nag nag nag. I wish she would move out and be free from interfering in my life. “
Why is it called a kilt?,1 day ago,The genie shrugged and snapped his fingers. The man pocketed the can and walked home hopefully that things would change. But when he got there he saw his wife crying and his mother in law getting into a car. “She’s leaving. “ his wife cried. “She told me she couldn’t stand the sight of me and you anymore so she leaving to try and start a new life. “ Two days later they got the phone call. The plane her mother was on has gone down. No one had survived.
I went to prison for something I didn’t do,1 day ago,His wife cried and cried. Seeming to never get over the loss of her mother or the way she had left. She sank into a deep and dark depression rarely leaving the house or taking care of herself. The husband found the genie in a can he had hidden and rubbed it.  “For fucks sake not again. “ the genie mumbled. “Didn’t you already see what happens when i use my powers? Hello! I’m a bad genie. Whatever you wish for I will ruin. “
The perfect joke,10 hours ago,"The husband: I know I know, but it’s my wife. She hasn’t been able to be happy since her mother left and died."
I don't often tell Dad Jokes,1 day ago,But when I do he laughs
"""Mad"" Mike Hughes died after trying to prove the earth is flat, by launching a rocket into the ground.",11 hours ago,He didn't prove the earth was flat. He did however prove that Gravity isn't just a theory.
I just found out that I can screw in a lightbulb all by myself.,19 hours ago,"However, I may need to see a doctor's to get it back out."
My doctor said the reason why I am sorry and then mad all the time is because I am bipolar,17 hours ago,"I told him no, it's because I'm half Italian and half Canadian"
My wife called because the car wouldn't start.,1 day ago,"She said it has water in the carburetor. Knowing my wife has no knowledge of anything mechanical I said, ""and how do you know there's water in the the carburetor?"" She said, ""because I drove off the pier and it's in the ocean. """
The government just banned the fifth month of the calendar year.,1 day ago,Everyone was dismayed.
A police officer pulled over someone speeding 15KM over the limit.,15 hours ago,Officer: explain yourself
No need to thank me.,2 hours ago,"Driver: Well I'm a Taurus officer, so it means I'm always in a rush."
What do you call a mallard that cheats at hide-and-seek?,1 day ago,Peking duck
I don’t tell jokes about fungi for a reason...,1 day ago,Too
An Irishman moves to England,1 day ago, for error.
A man sees a doctor....,22 hours ago,"At the ripe old age of 80 he passes away. A couple of his drinking buddies go around from house to house to collect money to be able to bury their friend. They stop at an old Englishman's house and ask if he can give them one euro to bury an Irishman. The Englishman tells them, ""Hell, I'll give you €10, just bury ten of them."""
Why is it so hot in Apple?,21 hours ago,"A man sees a doctor complaining that everything he touches, hurts."
"Decisions, decisions",1 day ago,"'Doctor, I touch on my arm, it hurts ' I touch on my leg it hurts, I touch on my chest it hurts'."
What do you call a head with no body and no nose?,1 day ago,"Doctor examines carefully and says, Everything you touch hurts because your finger is broken"
A dying grandma tells her grandchild....,1 day ago,It's because there are no windows.
You don't need a parachute to go skydiving....,1 day ago,You need a parachute to go skydiving twice!
I like my women like I like my coffee...,1 day ago,Falling off the roof of my car as I back out of my driveway
How do American schoolkids learn the metric system?,1 day ago,9 millimeters at a time
What's the difference between a 15 pupils special ed class and a 16 pupils special ed class?,19 hours ago,"Of course its one, stupid."
What's yellow and confuses homosexuals?,15 hours ago,Custard.
My therapist told me I might have anorexia.,1 day ago,As if I don't already have enough on my plate.
Why do mathematicians like to sit on their hands?,1 day ago,To make them number.
"Two maids worked for a couple. Maid A: I am tired of saying Yes,madam. Yes, madam.",15 hours ago,"Maid B : I am  tired of saying No,sir. No,sir."
Why didn't the hippie like the orchestra?,20 hours ago,He hated violins
"I don’t actually have a joke for you guys, but I do have a really awesome idea for cleaning up the trash on our planet! For one day, every single person in the country grabs a broom and cleans out every dirty corner they can find! It’s become quite popular across the country. You could say it’s...",1 day ago,...sweeping the nation
Robert Downey Jr. undergoes a sex change surgery,1 day ago,I guess now he's Fe Male
Whats a suicidal turtles favourite meal?,17 hours ago,A pile of straws
French assault rifle for sale,1 day ago,"Never fired, dropped only once."
The complaining man.,17 hours ago,"A hard working man lived with his stay at home wife and kids, whom were still in elementary school."
A man was walking in the woods when he was attacked by a wolf,1 day ago,"Every week day was the same, he would leave for work very early, leaving his wife his wife asleep, and return home very late, around 8 pm, and find her on the the couch."
A baby seal walks into the bar,23 hours ago,"One day he complained to God, that he works really hard, while his wife does nothing, compared to him anyway. He asked God to switch their bodies so he would be her and she in turn, would be he."
Did you hear about the guy who launched himself in a home-built rocket to attempt to prove the Earth is not a globe?,1 day ago,You could say he became a flat earther.
A woman asked a General in the army the last time he made love to a woman...,1 day ago,"The general stood tall and said ""1956 ma'am."" The woman, taken back by this answer said ""1956?! That long?! Let me make your night better..."" and the two sauntered away to a private room. The woman began to strip and the two made passionate love for an hour. The woman cuddled up to the army general afterward and said ""well, you sure haven't forgotten any thing since 1956..."". The general looked at her confused and said ""well I sure hope not. It's only 2130 now!"""
What day of the month people who struggle with english need to drink the most?,1 day ago,The 3st
"Seven has ""even"" in it.",22 hours ago,It's odd.
What do you call a group of men waiting for a haircut?,1 day ago,A barbercue.
How do you confuse a gay person?,22 hours ago,Seven
What do we want?,1 day ago,Low flying airplane noises
Interviewer- What do you make at your current job?,1 day ago,When do we want them?
If I had a penny for every time a girl didn't find me attractive,1 day ago,I'd eventually have enough money that they would.
TIL: Daniel Boone wore coon hats because he was born with an ear-shaped growth on his forehead,1 day ago,And that’s why people talk about the Wild Front Ear
"A priest has a heart attack, and is rushed to the hospital.",2 days ago,He wakes up as he's being rushed through the hospital on a gurney by two nurses.
A rich man needs to choose a wife out of three women,1 day ago,"""Am I in heaven?"" asks the disoriented priest."
"I was in a fancy lingerie shop and asked the women behind the counter ""Are these panties satin?""",1 day ago,"""No"" says one of the nurses. ""We're just taking a short cut through the children's ward."""
What do you call a disabled man when he’s smoking pot at a casino?,1 day ago,"He gives them each $10 and tell them to buy something that can fill the room. The next day, the first girl said she brought bottles of water, the cheapest thing she can find but still cannot fill the room. The second girl brought a perfume, and fill the room with scent. The third girl brought a candle, and fill the room with light. The rich man is impressed. He thinks for a second, then he tells everybody ""My wife will be, the girl with the largest breast."""
If Musk commited murder...,1 day ago,"She said ""No they are all new""..."
What does an unvaccinated child and my joke have in common?,1 day ago,A high roller.
A computer walks into a bar,1 day ago,"All of his friends goes: “Where have you been, we have waited half an hour” The computer replies: “Sorry it was a hard drive”"
A guy walks into a bar,1 day ago,And it hurts
Why does Kyle punch holes through drywall?,21 hours ago,"“You may not rest now, there are monsters nearby”"
"All the organs of the body were having a meeting, trying to decide who was the one in charge...",2 days ago,"""I should be in charge,"" said the brain , ""Because I run all the body's systems, so without me nothing would happen."""
"If you don't understand a ""walks into a bar"" joke",1 day ago,"""I should be in charge,"" said the blood , ""Because I circulate oxygen all over so without me you'd waste away."""
What's the difference between normal snow and German snow?,1 day ago,"""I should be in charge,"" said the stomach,"" Because I process food and give all of you energy."""
A cop sees an old woman carrying two large sacks. One of the sacks has a hole and is leaking 20 dollar bills.,2 days ago,"""I should be in charge,"" said the legs, ""because I carry the body wherever it needs to go."""
"A man in the hospital said to his doctor: "" docter i can't feel me legs!""",1 day ago,That's because it's an inside joke.
I thought I was a hypocondriac..,23 hours ago,but I saw the doctor and he told me it's all in my head.
I beat my kids when we play my old video games.,1 day ago,(I just saw this joke somewhere and I wanted to put it here)
Pun enters a room and kills 10 people.,2 days ago,"Sometimes I win at the games, too."
My girlfriend and I used to go to the gym together...,1 day ago,"Pun in, ten dead."
So the Bears were looking for a new quarterback.,1 day ago,...but we didn't work out.
Why did Adele cross the road?,1 day ago,"The coach had put together the perfect team for the Chicago Bears. The only thing that was missing was a good quarterback. He had scouted all the colleges and even the Canadian and European Leagues, but he couldn't find a ringer who could ensure a Super Bowl win."
How many anti-vaxxers does it take to change a light bulb?,1 day ago,"Then one night while watching CNN he saw a war-zone scene in Afghanistan . In one corner of the background, he spotted a young Afghan Muslim soldier with a truly incredible arm. He threw a hand-grenade straight into a 15th story window 100 yards away."
Comas can really change the meaning of a sentence...,2 days ago,KABOOM!
What do you call a whale that plays basketball?,1 day ago,Kobe Dick
What do you call a quick Doberman Pinscher?,1 day ago,Adobe Flash
Why was the Nickelodeon character Avatar Aang so controversial?,1 day ago,He was trans-bender
I have a hilarious crustacean joke.,1 day ago,But I’m not going to share it.
I've been a bookkeeper for the past 20 years ...,1 day ago,"I know, I’m so shellfish!"
Did you hear about the Roman arena combatant who was caught canabilizing a woman?,1 day ago,... and the librarian is
What do you give a dog that has a high temperature?,1 day ago,.
I was playing Plague Inc. and Dysentery mutated,1 day ago,"Showed no remorse, he was gladiator."
Why can't deaf people go to prison?,1 day ago,Because you can't condemn someone without a hearing.
54% of the world are living on less than $2 a day.,1 day ago,And I thought I was frugal.
I noticed my maple syrup bottle had the highest rating possible.,1 day ago,It was given a grade eh.
Heaven or Hell,1 day ago,While walking down the street one day a corrupt Senator (that may be redundant) was tragically hit by a car and died.
She said give me 8” and make it hurt!,1 day ago,His soul arrives in heaven and is met by St. Peter at the entrance.
I'm confused about rule 8 in this subreddit,1 day ago,"""Welcome to heaven,"" says St.. Peter. ""Before you settle in, it seems there is a problem. We seldom see a high official around these parts, you see, so we're not sure what to do with you."""
Knock-knock,1 day ago,"""No problem, just let me in,"" says the Senator."
I slept with a Blind Girl,1 day ago,"""Well, I'd like to, but I have orders from the higher ups. What we'll do is have you spend one day in hell and one in heaven. Then you can choose where to spend eternity."""
A rich woman and a bank director.,1 day ago,"So a woman walks into the bank looking to deposit her money, 2 000 000 dollars. The agent in the bank says he can't help her because it's too much money, so she needs to talk to the bank director, and she does."
what's the slowest type of salad,1 day ago,"Entering his office, he can't help it but to ask where the money is from. And he get's the answer, it's betting. Impossible he says. And she told him that she could make a bet with him that his balls are in the shape of a square, he thinks a little bit about it and assures they are not, and then accepting the bet of 300 000 dollars, and they decided to meet up again tomorrow by 9 in the morning to confirm."
My new girlfriend,1 day ago,"Next day, she and another man came at 9 to the bank director's office. The guy she came with was there to assure that they were square."
What do you call someone who beats up dessert chefs?,1 day ago,"Bank director carefully takes his pants down, the woman takes her hands firmly around his balls and the man she came with immediately started crying, and the bank director is confused and ask why he is crying, and she told him that she made a bet with him of 600 000 dollars, that by 9 tomorrow morning I will have the balls of the bank director in my hands."
It seems everyone either loves or hates the Parks & Rec show,2 days ago,coleslow
"""I don't think you have what it takes to be a mime.""",1 day ago,"I was lying next to my new girlfriend and I said, ""you're different to all the other girls I've slept with."" She said, ""that's because I'm a bloke, you twat."" That's what I love about Martin... She's got a great sense of humour."
What does a penis and a rubiks cube have in common?,1 day ago,Cobbler clobberer.
Where are most super heroes from?,1 day ago,I guess you could say it's poehlerizing
A teacher asks her class what they want to be when they grow up.,23 hours ago,A blonde girl stands up and exclaims: “I want to be a man with boobs and no penis!”
The first humans spent many hours seeing what the sun did in the sky,2 days ago,Then they decided to call it a day.
Headless Horsemen got so bored of the Halloween party.,1 day ago,He said I'm head out.
What do you call a South American goat-killing monster with a cold?,2 days ago,Achoopacabra
"It was George the Mailman's last day on the job after 35 years of carrying the mail through all kinds of weather to the same neighborhood. When he arrived at the first house on his route, he was greeted by the whole family who congratulated him and sent him on his way with a tidy gift envelope.",1 day ago,"At the second house, they presented him with a box of fine cigars. The folks at the third house handed him a selection of terrific fishing lures."
What did the glasses say to the face?,1 day ago,"At the fourth house, he was met at the door by a strikingly beautiful blonde woman in a revealing negligee. She took him by the hand, gently led him through the door, which she closed behind him, and took him up the stairs to the bedroom where she blew his mind with the most passionate love he had ever experienced."
My therapist told me I have “Superiority complex”.,1 day ago,"When he had enough, they went downstairs and she fixed him a giant breakfast: eggs, potatoes, ham, sausage, blueberry waffles, and fresh-squeezed orange juice. When he was truly satisfied, she poured him a cup of steaming coffee. As she was pouring, he noticed a dollar bill sticking out from under the cup's bottom edge. ""All this was just too wonderful for words,"" he said, ""But what's the dollar for?"""
I’m holding a support group for men with erectile dysfunction.,1 day ago,"""Well,"" she said, ""Last night, I told my husband that today would be your last day, and that we should do something special for you. I asked him what to give you. He said, 'Screw him. Give him a dollar.' The breakfast was my idea."""
My sister gets good grades on everything!,1 day ago,She even got an A on her blood type!
My poor knowledge of Greek mythology...,2 days ago,She did fail her gender though...
What do you call a virus that transfers from animals to humans discovered in Hawaii?,1 day ago,...has always been my Achilles' elbow.
Finding an ants gender.,2 days ago,It’s still called a corona virus
Why did Jon Snow stand in line for 6 hours at the Apple Store?,1 day ago,To find an ants gender toss it in some water.
I went to the Reddit restaurant,1 day ago,If it sinks = girl ant
I farted in my wallet.,2 days ago,If it floats = Buoyant
Guy walks into a bar,1 day ago,For the watch
Your Mama's so fat,1 day ago,.. her CPAP runs on diesel.
Where did sally go during the bombing?,2 days ago,Everywhere
Why do they call it kinetic sand?,2 days ago,Because it lacks potential
mom friends,1 day ago,"Are you trying to make your mom friends, or trying to make people who are moms, your friend? I doubt you are trying to make your friends into moms. I try not to."
Did you hear about the guy who was shocked to death while standing at the mic when it started to rain at the classical music concert?,1 day ago,He was the conductor
What Japanese drink goes on a Canadian foot?,1 day ago,Sake
A farmer thought he had 198 cows in his pasture,2 days ago,but there were 200 when he rounded them up
You guys ever seen that movie Fifty First Dates?,1 day ago,"I'm still waiting for the prequel, Fiftieth Dates."
My dad is a wizard,1 day ago,He can turn whiskey into domestic violence
"LMAO IM AT MY SCHOOL TALENT SHOW AND DUDE SAYS “Before I begin, I want to make sure this mic is working”",3 days ago,"“If your name is Michael, please stand up”"
Surprise sex is the best thing to wake up to...,1 day ago,Then a couple dudes stand up
How much money does Mariah Carey make every Christmas?,1 day ago,And he goes   “That concludes the mike check”
Two flies are in a restaurant.,1 day ago,stolen from twitter  @ cheyrubi
Sherlock Holmes and Dr. Watson go camping...,2 days ago,Unless you're in prison.
What did the artist with his ear cut off scream to his van when the engine wouldn’t work?,1 day ago,More than you could ever know
You only need $25 to get your EX back,1 day ago,They call the waiter and they say:
I ask the masseuse to give me an happy ending today...,1 day ago,she told me she never went to Wuhan
What’s the best rated flag?,2 days ago,"The US, it has fifty stars!"
Hot girl at prom,2 days ago,Edit: you seem to think I actually like living in the US
How are women and electricity similar?,2 days ago,"A teenage boy is getting ready to take his girlfriend to the prom. First he goes to rent a tux, but there’s a long tux line at the shop and it takes forever."
What’s a pirates favourite letter?,2 days ago,"Next, he has to get some flowers, so he heads over to the florist and there’s a huge flower line there. He waits forever but eventually gets the flowers."
"There's 2 types of people in this world,",1 day ago,"Then he heads out to rent a limo. Unfortunately, there’s a large limo line at the rental office, but he’s patient and gets the job done."
Just got on the knight shift,1 day ago,"Finally, the day of the prom comes. The two are dancing happily and his girlfriend is having a great time. When the song is over, she asks him to get her some punch, so he heads over to the punch table and there’s no punchline."
People say selfburn is rare,1 day ago,You don't wanna mess around with either without rubber.
If pronouncing b’s as v’s makes me sound Russian,3 days ago,Then Soviet
She: love never bends the knee,1 day ago,"Me: yeah, it just changes the position."
My love life is like Santa Claus.,2 days ago,It exists thanks to gullible six year olds
What would Herb Brooks have said if he saw the movie Miracle,1 day ago,Again
I have like 50 jokes about the unemployed,3 days ago,"Trouble is, none of them work."
Stalin appears to Putin in a dream.,2 days ago,"Putin asks Stalin, ""Why is everything here so bad? What should I do to make Russia great again?"""
I went to see the local priest.,2 days ago,"Stalin replies, ""Execute most of the government and paint the Kremlin blue."""
I ordered a drink once.,2 days ago,"""Why blue?"" asks a perplexed Putin."
What do French People smoke?,2 days ago,Oui'd
The difference between Republicans and Democrats and centrists,1 day ago,"I have prepared the following list to help the discerning eye tell the difference between Republicans, Democrats, and for a slight bonus at the end, how to identify a centrist."
Best remedy for constipation,2 days ago,The Centrist:
"How many ""friend zoned"" guys does it take to change a lightbulb?",2 days ago,"""JUST OPEN THE D@#* PORTAL AND LET THE DARK FORCES INVADE OUR WORLD, ALREADY!!!"""
CHEESEBURGER: $1.50 CHICKEN SANDWICH: $2.50 HAND JOB: $10.00,2 days ago,Shit take mushrooms
What’s the last thing you want to hear during a prostate exam?,2 days ago,"How many ""friend zoned"" guys does it take to change a light bulb?"
I just found out that there are at least three different ways that temperature is measured,2 days ago,None. They just compliment it and get mad when it won't screw.
"The past, present, and future walked into a bar",2 days ago,"A guy walks into a pub and sees a sign hanging over the bar that reads: CHEESEBURGER: $1.50 CHICKEN SANDWICH: $2.50 HAND JOB: $10.00 He walks up to the bar and beckons one of the three exceptionally attractive blondes serving drinks.  ""Can I help you?"" she asks.  ""I was wondering,"" whispers the man. ""Are you the one who gives the hand jobs?"" ""Yes,"" she purrs. ""I am."" The man replies, ""Well, wash your hands. I want a cheeseburger."""
I made a playlist for hiking.,2 days ago,"... ... It has music from Peanuts, The Cranberries and Eminem. I call it my Trail Mix."
I finally got a job as a horse breeder's assistant.,2 days ago,I did not come up with the joke. I just heard it from a friend and thought it was hilarious and wanted to share it hoping it would make someone else smile as well :)
If you mix a lion and a tiger you get a liger. If you mix a horse and a donkey you get a mule. What happens when you mix an orangutan and a lawyer?,2 days ago,"It doesn't pay much, but it's a stable job."
The young laboratory technician quit his job recently,2 days ago,Nothing. The lawyer doesn't have enough human DNA.
"My friend told me I looked especially amazing today. So I told him,",2 days ago,He was going through so much shit
Why is lettuce the most religious vegetable?,2 days ago,"""You look especially imaginary."""
What do the 14 year old mother and the child inside her have in common?,1 day ago,Lettuce pray.
A businessman visits Japan for the first time,2 days ago,The father
