Title,Date Time,Body
r/jokes has a discord and you need to join!,12 months ago,Wait. Never mind. That wasn't my waiter.
My Chinese waiter thinks all white people look alike and gave my food to the wrong customer,11 hours ago,You drop it in water. If it sinks: girl ant.
How do you tell the sex of an ant?,14 hours ago,If it floats...
A police officer pulls a guy over for speeding and has the following exchange,19 hours ago,:Officer: May I see your driver's license?
"Been chatting with this 14 year old girl. Real sexy and flirty. Things are going great, but now she tells me she's an undercover cop.",18 hours ago,Driver: I don't have one. It was revoked when I got my 5th DWI.
Weinstein didn’t kill himself,2 hours ago,Officer: May I see the registration for this vehicle?
Today I quit drinking for good,2 hours ago,Driver: It's not my car. I stole it. Officer: The car is stolen?
MY SO left me because I'm too insecure,4 hours ago,"Driver: That's right. But come to think of it, I think I saw the registration in the glove box when I was putting my gun in there."
My wife was sick to the stomach when I told her I put ginger in the curry,1 hour ago,She really loved that cat
"My dad just read an article entitled ""Mars is humming. Scientists aren't sure why.""",2 hours ago,"His response? ""Maybe it doesn't know the words."""
I used to be a man stuck in a women's body.,1 hour ago,Then my mom gave birth to me 👶
"There were three POWs together in a British prison in the Second World War, a German, a Japanese, and an Italian.",11 hours ago,"The British began by torturing the German. After long hours of silence infected by bloodcurdling screams, he talked, and was sent back to the prison, ashamed. He told the others what he had done and urged them to be stronger than he was."
"Two statues (one nude male, one nude female) sit beside each other at the entrance of Central Park…",23 minutes ago,"They next began torturing the Japanese man. Through all the pain and agony, he stayed strong for three days, but in the end, talked. He was sent back to the prison, having brought shame to himself, his family, and his country."
A man was struck by a bus on a busy street.,2 hours ago,"They finally sent in the Italian. For an unending three weeks, they tortured him, until they realized if they did anything else to the poor man, he would die, so they sent him back. When he got back to the prison cell bloody and battered, the other POWs asked him, ""So? Did you talk?"""
A man was hospitalised with 6 plastic horses up his ass,23 hours ago,"""How could I talk with my hands tied behind my back?"""
I’m thinking about trying cyanide,1 hour ago,"One day, very early in the morning, an angel comes down from heaven. He looks the statues up and down, and with a flick of his wrist, *POOF!* he turns the statues into real people."
As my wife lay in the coma the doctors approached the life support machine.,54 minutes ago,"""No, no, please,"" I sobbed, ""just a little while longer. '"
The new mobile theater inside an R/V sucks.,56 minutes ago,But my pleading didn't help. They woke her up.
I have a question about cow tipping.,9 hours ago,All they show is trailers.
Tinder is for rookies,5 minutes ago,Is 15% enough?
My next door neighbour ordered some new drapes for her living room but they accidentally delivered them to my house .,1 hour ago,Go to Facebook marketplace and search for wedding dresses. It'll show you recently divorced females in your area. From there you can filter by size
A man came in to give his application to the manager.,2 hours ago,"I went round to her house and when she opened the door I said in a doomy voice ""It's curtains for you Carol"" how we both laughed, then I stabbed her."
"When single ladies get to the age of 50, they tend to get lots of cats.",1 day ago,"But the manager asked, “Why is there a four-year gap in your application?”"
Why couldn’t the dragon get a boner?,1 hour ago,"And the man responded, “Yail.”"
I love the smell of my f5 key...,4 hours ago,It is very refreshing
I have an unusual fear of Semi-trucks,4 hours ago,I guess you could call me antisemitic.
He who laughs last,4 minutes ago,Probably didn't filter by new
A LITTLE girl was at a wedding with her parents.,2 hours ago,"Slightly confused after the nuptials, she asked her mother why the bride changed her mind. “What do you mean?” asked the mother, perplexed."
Thank you weight loss surgeons,15 minutes ago,"“Well,” the little girl said, “She went down the aisle with one man and came back with another.”"
New study shows that overweight women...,19 hours ago,What you do takes guts.
JOHN LENNON: Imagine all the people living life in peace.,3 hours ago,...live significantly longer than men who mention it.
What do you call a smart stoner?,16 minutes ago, That’s beautiful.
I went to an over 50's shoe maker convention.,9 hours ago,Load of old cobblers.
If I can’t be Mozart...,3 hours ago, “I’ll be Bach.”
"I'm going to create a holistic, astrology focused mechanic's garage",6 hours ago,"Mind, Auto Body & Spirit"
"I dated a surgeon who turned out to be a kleptomaniac, she stole my heart..",4 minutes ago,... and kidney.
There's been a new kind of diabetes discovered in Mexico.,2 hours ago,"Doctors are calling it ""Type Juan""."
What do you call a guy trapped in latex trying to run through the woods?,2 hours ago,Forest Gimp.
I asked my doctor if coronavirus spreads through sex,6 hours ago,"""if you do handshakes while doing it, yeah"""
Two hunters are in the woods,10 hours ago,"The first hunter gets down on his knees examining the droppings and scat on the ground, and the second hunter, confused, asks him “what are you doing”?"
What's the difference between a boy moth and a girl moth?,7 hours ago,Moth balls
What did the people of the Socialist country use before candles?,7 hours ago,Electricity!
Donald Trump went to see a Psychic recently,7 hours ago,"Donald Trump went to a psychic recently to ask what she saw in his future. She closed her eyes and went into a trance before saying the following: ""I see a parade in your honor in Washington D.C. There are hundreds of thousands of people lining the streets. They are all smiling, and cheering, and waving American flags. Millions more are watching the event on television - - across the country and around the world. There is a great feeling of excitement and profound joy. The world has never seen such happiness and joy. I see Melania. She has the biggest smile on her face. She too has never been this happy."""
"It finally happened! The flight attendant asked ""is there a doctor on this flight?"" and I leapt up and said yes!",4 hours ago,"With that, Trump said smugly, ""I hope my hair looks OK. How's my hair?"""
What do you call a martial artist who's masking his identity?,6 hours ago,"She replied, ""I can't tell. Its closed casket."""
Hunger Games is very different from other fandoms,1 hour ago,"Did a tracheotomy at 30,000ft with a razor blade and ballpoint pen."
"If men call short women ""petite"", what do women call short men?",17 hours ago,"He didn't make it, but the thrill was undeniable. Thinking of going to doctor school now."
A man walks into an Apple store,19 hours ago,"Not sure, but you might want to use his judonym."
Wanna hear a joke?,5 hours ago,Epstein killed himself.
How do you give a toddler a mid-life crisis?,10 hours ago,You tell them they've already had one.
I never understood why people are so scared of snakes,7 hours ago,They're completely armless
I'm not saying all factory workers are robots...,7 hours ago,All I'm saying is when they get to work they've returned to their factory setting.
How do you get a calculator mad?,11 hours ago,By pushing it's buttons!
A police officer called into the station from his squad car.,9 hours ago,"""I have a homicide here,"" he says. ""A woman shot her husband for stepping on the floor she just mopped.""  "" Have you arrested her?"" asks the sergeant. ""No, not yet. The floor's still wet."""
Why do worms consider themselves to be hippies?,8 hours ago,It's because they're down to earth.
My wife and I are like the two Koreas,11 hours ago,We'll never come together
I saw a guy walking through a thunderstorm with a newspaper sat on his head,6 hours ago,"He wasn’t holding it over his head, he just sat it on his head."
What has 3 balls and flies?,9 hours ago,And I thought to myself “if that ink runs off the paper onto his head... that’s gonna make headlines.”
PayPal ain't the only Pal,25 minutes ago,"ET, the Extra Testicle."
I was never a fan of Jerry Seinfeld until I met him,4 hours ago,"If Elon Musk opened a homosexual dating site, what would he call it? GayPal"
What does Bruce Lee drink to stay hydrated?,4 hours ago,He turned out to be a stand up guy
I like my men like I like my grilled cheese.,31 minutes ago,WAH-TAAHH
"Guy goes to a doctor and says I'm really sick, don't know what's wrong with me. Doctor says wow, I don't know what this is - so I will need a stool sample, a urine specimen, and and sperm sample.",16 hours ago,Stuck together by a sticky substance.
What’s a pirates favourite letter?,12 hours ago,"Guy says, Doc I'm kind of in a hurry. Can I just leave you my shorts?"
What charges can you expect when you mix sodium chloride and lithium ion?,9 hours ago,A salt and battery charges.
Did you hear about the race between two ties?,12 hours ago,It was neck and neck
What do we call a monster we can't find ?,2 hours ago,Where wolf
Women and not being attractive,21 hours ago,"If I had a dollar for every girl that found me unattractive, they would eventually find me attractive."
It's not that difficult to eat a clock...,20 hours ago,...But it's time consuming.
How do you make a chicken drink?,8 hours ago,Put it in a blender.
Three guys go to a ski lodge,11 hours ago,"Three guys go to a ski lodge and there aren't enough rooms, so they have to share a bed."
I had to put my foot down today,23 hours ago,"In the middle of the night, the guy on the right wakes up and says, ""I had this wild, vivid dream of getting a hand job!"""
If wine is Jesus's Christ's blood and bread is Jesus's Christ's body,12 hours ago,Then what is mayo?
How does the German counterfeiter take his bourbon?,1 day ago,On Xerox.
Did you hear about the mathematician who was afraid of negative numbers ?,13 hours ago,He'll stop at nothing to avoid them
PS4/Xbox joke,10 hours ago,Oh no! Playstation and xbox online services are down! Someone call an ambulance! Wii U Wii U Wii U
What's a funny geneticist's favorite shape?,14 hours ago,A pun-nett square
Me,4 hours ago,And the punch-line is my birthday
There's no I in team,4 hours ago,"My Hs basketball coach once gathered us all together at half court after a VERY intense practice. He held a basketball as he looked around at us. ""Good practice guys. I know this was probably more than most of yal are use to. But I wanted to leave you guys with this: Theres no I in team."" After a couple seconds passed, Christian Allenby, who had recently scored 58 points along with 9 assists & 6 rebounds 2 steals & 8 blocks in our semi final championship game, walked up to the coach and grabbed the ball out of his hands. ""No, but there is an I in win"" he smoothly said as he launched a jump shot from half court that swished the net so hard that our coach got shot and had to be taken to the hospital. 2015 State Champs baby!!!!!!!"
What do you call an uncool worm?,18 hours ago,Warm!
"I came home to find candle light in my dining table,my favourite meatloaf in the oven and my wife dressed up in lingerie",16 hours ago,"She came close to me and whispered "" I shaved my vagina . Do you know what that means ?"""
"""The problem with quotes found on the internet is that they are often not true""",16 hours ago,"""Oh fuck , you clogged the drains again! Where is the plunger? """
What's worse than having camel toe?,9 hours ago,Abraham Lincoln
How do I get my crush to like me?,1 hour ago,Having a boar shin.
What do you call pudding that’s starting to go bad?,1 day ago,wait this isn't google
What do you call a picture of the worlds smallest fish,5 hours ago,Off-pudding
She: I only date 6 feet 1 inch men,5 hours ago,Microfiche
"A man is sitting outside enjoying his morning coffee when he notices his neighbor jumps off his horse, walks behind him, lifts up his tail, and kisses him right where the sun don't shine...",1 day ago,Me:
Title,Date Time,Body
r/jokes has a discord and you need to join!,12 months ago,Wait. Never mind. That wasn't my waiter.
My Chinese waiter thinks all white people look alike and gave my food to the wrong customer,11 hours ago,You drop it in water. If it sinks: girl ant.
How do you tell the sex of an ant?,14 hours ago,If it floats...
A police officer pulls a guy over for speeding and has the following exchange,19 hours ago,:Officer: May I see your driver's license?
"Been chatting with this 14 year old girl. Real sexy and flirty. Things are going great, but now she tells me she's an undercover cop.",18 hours ago,Driver: I don't have one. It was revoked when I got my 5th DWI.
Weinstein didn’t kill himself,2 hours ago,Officer: May I see the registration for this vehicle?
Today I quit drinking for good,2 hours ago,Driver: It's not my car. I stole it. Officer: The car is stolen?
MY SO left me because I'm too insecure,4 hours ago,"Driver: That's right. But come to think of it, I think I saw the registration in the glove box when I was putting my gun in there."
"Two statues (one nude male, one nude female) sit beside each other at the entrance of Central Park…",23 minutes ago,"One day, very early in the morning, an angel comes down from heaven. He looks the statues up and down, and with a flick of his wrist, *POOF!* he turns the statues into real people."
"My dad just read an article entitled ""Mars is humming. Scientists aren't sure why.""",2 hours ago,"The man and woman stare at each other in amazement, but their attention soon turns to the angel, who's quite satisfied with himself, grinning from ear to ear."
My wife was sick to the stomach when I told her I put ginger in the curry,1 hour ago,"He says to the couple, ""You guys have been staring at each other while locked in stone for the last 100 years, completely unable to do a thing about your urges for each other."" He pauses, and then adds: ""It's still pretty early, and people don't usually get to the park for another 30 minutes. You two should go into that covered area and…well, just have a good time."""
I used to be a man stuck in a women's body.,1 hour ago,"The man caught the eye of the woman, who had a twinkle in her eye and wore a mischievous grin. She bit her lip seductively, and with that the man grabbed her hand and the two ran off to the bushes."
"There were three POWs together in a British prison in the Second World War, a German, a Japanese, and an Italian.",11 hours ago,"The angel then found himself privy to giggles, laughter, rustling, and squeals of delight. Fifteen minutes later, the couple emerged from the bushes hand-in-hand, out of breath and faces flush."
A man was struck by a bus on a busy street.,2 hours ago,"The angel glanced at his watch. ""You still have fifteen minutes, you know. You can have another round if you'd like!"""
A man was hospitalised with 6 plastic horses up his ass,23 hours ago,"The woman turned excitedly to the man and exclaimed, ""Ok! But this time, *you* have to hold the pigeon while *I* get to shit on its head!!"""
I’m thinking about trying cyanide,1 hour ago,"His response? ""Maybe it doesn't know the words."""
As my wife lay in the coma the doctors approached the life support machine.,54 minutes ago,"""No, no, please,"" I sobbed, ""just a little while longer. '"
The new mobile theater inside an R/V sucks.,56 minutes ago,But my pleading didn't help. They woke her up.
I have a question about cow tipping.,9 hours ago,All they show is trailers.
Tinder is for rookies,6 minutes ago,Is 15% enough?
My next door neighbour ordered some new drapes for her living room but they accidentally delivered them to my house .,1 hour ago,Go to Facebook marketplace and search for wedding dresses. It'll show you recently divorced females in your area. From there you can filter by size
A man came in to give his application to the manager.,2 hours ago,"I went round to her house and when she opened the door I said in a doomy voice ""It's curtains for you Carol"" how we both laughed, then I stabbed her."
"When single ladies get to the age of 50, they tend to get lots of cats.",1 day ago,"But the manager asked, “Why is there a four-year gap in your application?”"
Why couldn’t the dragon get a boner?,1 hour ago,"And the man responded, “Yail.”"
I love the smell of my f5 key...,4 hours ago,It is very refreshing
I have an unusual fear of Semi-trucks,4 hours ago,I guess you could call me antisemitic.
He who laughs last,4 minutes ago,Probably didn't filter by new
A LITTLE girl was at a wedding with her parents.,2 hours ago,"Slightly confused after the nuptials, she asked her mother why the bride changed her mind. “What do you mean?” asked the mother, perplexed."
Thank you weight loss surgeons,15 minutes ago,"“Well,” the little girl said, “She went down the aisle with one man and came back with another.”"
New study shows that overweight women...,19 hours ago,What you do takes guts.
JOHN LENNON: Imagine all the people living life in peace.,3 hours ago,...live significantly longer than men who mention it.
What do you call a smart stoner?,16 minutes ago, That’s beautiful.
I went to an over 50's shoe maker convention.,9 hours ago,Load of old cobblers.
If I can’t be Mozart...,3 hours ago, “I’ll be Bach.”
"I'm going to create a holistic, astrology focused mechanic's garage",6 hours ago,"Mind, Auto Body & Spirit"
"I dated a surgeon who turned out to be a kleptomaniac, she stole my heart..",5 minutes ago,... and kidney.
There's been a new kind of diabetes discovered in Mexico.,2 hours ago,"Doctors are calling it ""Type Juan""."
What do you call a guy trapped in latex trying to run through the woods?,2 hours ago,Forest Gimp.
I asked my doctor if coronavirus spreads through sex,6 hours ago,"""if you do handshakes while doing it, yeah"""
Two hunters are in the woods,10 hours ago,"The first hunter gets down on his knees examining the droppings and scat on the ground, and the second hunter, confused, asks him “what are you doing”?"
What's the difference between a boy moth and a girl moth?,7 hours ago,Moth balls
What did the people of the Socialist country use before candles?,7 hours ago,Electricity!
Donald Trump went to see a Psychic recently,7 hours ago,"Donald Trump went to a psychic recently to ask what she saw in his future. She closed her eyes and went into a trance before saying the following: ""I see a parade in your honor in Washington D.C. There are hundreds of thousands of people lining the streets. They are all smiling, and cheering, and waving American flags. Millions more are watching the event on television - - across the country and around the world. There is a great feeling of excitement and profound joy. The world has never seen such happiness and joy. I see Melania. She has the biggest smile on her face. She too has never been this happy."""
"It finally happened! The flight attendant asked ""is there a doctor on this flight?"" and I leapt up and said yes!",4 hours ago,"With that, Trump said smugly, ""I hope my hair looks OK. How's my hair?"""
What do you call a martial artist who's masking his identity?,6 hours ago,"She replied, ""I can't tell. Its closed casket."""
Hunger Games is very different from other fandoms,1 hour ago,"Did a tracheotomy at 30,000ft with a razor blade and ballpoint pen."
"If men call short women ""petite"", what do women call short men?",17 hours ago,"He didn't make it, but the thrill was undeniable. Thinking of going to doctor school now."
A man walks into an Apple store,19 hours ago,"Not sure, but you might want to use his judonym."
Wanna hear a joke?,5 hours ago,Epstein killed himself.
How do you give a toddler a mid-life crisis?,10 hours ago,You tell them they've already had one.
I never understood why people are so scared of snakes,7 hours ago,They're completely armless
I'm not saying all factory workers are robots...,7 hours ago,All I'm saying is when they get to work they've returned to their factory setting.
How do you get a calculator mad?,11 hours ago,By pushing it's buttons!
A police officer called into the station from his squad car.,9 hours ago,"""I have a homicide here,"" he says. ""A woman shot her husband for stepping on the floor she just mopped.""  "" Have you arrested her?"" asks the sergeant. ""No, not yet. The floor's still wet."""
Why do worms consider themselves to be hippies?,8 hours ago,It's because they're down to earth.
My wife and I are like the two Koreas,11 hours ago,We'll never come together
I saw a guy walking through a thunderstorm with a newspaper sat on his head,6 hours ago,"He wasn’t holding it over his head, he just sat it on his head."
What has 3 balls and flies?,9 hours ago,And I thought to myself “if that ink runs off the paper onto his head... that’s gonna make headlines.”
PayPal ain't the only Pal,26 minutes ago,"ET, the Extra Testicle."
I was never a fan of Jerry Seinfeld until I met him,4 hours ago,"If Elon Musk opened a homosexual dating site, what would he call it? GayPal"
What does Bruce Lee drink to stay hydrated?,4 hours ago,He turned out to be a stand up guy
I like my men like I like my grilled cheese.,31 minutes ago,WAH-TAAHH
"Guy goes to a doctor and says I'm really sick, don't know what's wrong with me. Doctor says wow, I don't know what this is - so I will need a stool sample, a urine specimen, and and sperm sample.",16 hours ago,Stuck together by a sticky substance.
What’s a pirates favourite letter?,12 hours ago,"Guy says, Doc I'm kind of in a hurry. Can I just leave you my shorts?"
What charges can you expect when you mix sodium chloride and lithium ion?,9 hours ago,A salt and battery charges.
Did you hear about the race between two ties?,12 hours ago,It was neck and neck
What do we call a monster we can't find ?,2 hours ago,Where wolf
Women and not being attractive,21 hours ago,"If I had a dollar for every girl that found me unattractive, they would eventually find me attractive."
It's not that difficult to eat a clock...,20 hours ago,...But it's time consuming.
How do you make a chicken drink?,8 hours ago,Put it in a blender.
Three guys go to a ski lodge,11 hours ago,"Three guys go to a ski lodge and there aren't enough rooms, so they have to share a bed."
I had to put my foot down today,23 hours ago,"In the middle of the night, the guy on the right wakes up and says, ""I had this wild, vivid dream of getting a hand job!"""
If wine is Jesus's Christ's blood and bread is Jesus's Christ's body,12 hours ago,Then what is mayo?
How does the German counterfeiter take his bourbon?,1 day ago,On Xerox.
Did you hear about the mathematician who was afraid of negative numbers ?,13 hours ago,He'll stop at nothing to avoid them
PS4/Xbox joke,10 hours ago,Oh no! Playstation and xbox online services are down! Someone call an ambulance! Wii U Wii U Wii U
What's a funny geneticist's favorite shape?,14 hours ago,A pun-nett square
Me,4 hours ago,And the punch-line is my birthday
There's no I in team,4 hours ago,"My Hs basketball coach once gathered us all together at half court after a VERY intense practice. He held a basketball as he looked around at us. ""Good practice guys. I know this was probably more than most of yal are use to. But I wanted to leave you guys with this: Theres no I in team."" After a couple seconds passed, Christian Allenby, who had recently scored 58 points along with 9 assists & 6 rebounds 2 steals & 8 blocks in our semi final championship game, walked up to the coach and grabbed the ball out of his hands. ""No, but there is an I in win"" he smoothly said as he launched a jump shot from half court that swished the net so hard that our coach got shot and had to be taken to the hospital. 2015 State Champs baby!!!!!!!"
What do you call an uncool worm?,18 hours ago,Warm!
"I came home to find candle light in my dining table,my favourite meatloaf in the oven and my wife dressed up in lingerie",16 hours ago,"She came close to me and whispered "" I shaved my vagina . Do you know what that means ?"""
"""The problem with quotes found on the internet is that they are often not true""",16 hours ago,"""Oh fuck , you clogged the drains again! Where is the plunger? """
What's worse than having camel toe?,9 hours ago,Abraham Lincoln
How do I get my crush to like me?,1 hour ago,Having a boar shin.
What do you call pudding that’s starting to go bad?,1 day ago,wait this isn't google
What do you call a picture of the worlds smallest fish,5 hours ago,Off-pudding
She: I only date 6 feet 1 inch men,5 hours ago,Microfiche
"A man is sitting outside enjoying his morning coffee when he notices his neighbor jumps off his horse, walks behind him, lifts up his tail, and kisses him right where the sun don't shine...",1 day ago,Me:
Why does Waldo always wear stripes?,22 hours ago,Because he doesn’t want to be spotted
A lady returns home late at night and finds one of her servants in her bedroom.,16 hours ago,"She approaches him and says, ""Take off my shoes."""
Where do horses go to get better?,1 day ago,He takes off her shoes.
This spot is for you.,3 hours ago,"""Take off my dress."""
When I was younger I thought wearing glasses meant you were smarter than everyone else...,18 hours ago,He takes off her dress.
"A priest, a rabbit, and a monk walk into a bar...",1 hour ago,"""Take off my bra."""
I GOT A GIRLFRIEND!!!!,3 hours ago,He takes off her bra.
